{
  "schema_version": "AMG_CONFIG_SM_V1",
  "unit": "mm",
  "mesh_policy": {
    "h0_mm": 3.0,
    "h_min_mm": 0.5,
    "h_max_mm": 8.0,
    "growth_rate": 1.25,
    "quality_profile": "AMG_QA_SHELL_V2"
  },
  "model_pipeline": {
    "part_classifier": "models/part_classifier/model.pkl",
    "entity_segmentation": "models/entity_segmentation/model.pt",
    "quality_surrogate": "models/quality_surrogate/model.pkl"
  },
  "ansa": {
    "batch_session": "AMG_SHELL_CONST_THICKNESS_V2",
    "quality_template": "AMG_QA_SHELL_V2",
    "export_solver": "NASTRAN"
  }
}
